### ISSUE TITLE
No internet connection resulted in 'Couldn't connect to TM 3.5 Server'

### ISSUE THREAD

**Issue by luchia** [TeamMentor/TM_4_0_Design#551]
While trying to login, this happened -

![screen shot 2015-03-14 at 12 20 54 pm](https://cloud.githubusercontent.com/assets/4547737/6652206/0f790284-ca9a-11e4-8bf8-6d0901a06edd.png)

Where does this page come from? We should probably have the 'error occurred' template instead of this.

**Comment by roman87** [comment]
Hmm.. yes we should show a regular error page and log the fact that the backed server is not available. 
@michaelhidalgo  can you take a shot at this? 
@luchia btw, you can change the 3.5 server we are pointing to here node/misc/Config.coffee

What I do, is I run a VM with 3.5 backend and have my TM 4.0 talk to it

**Comment by michaelhidalgo** [comment]
Yes, It should be a easy fix:)

2015-03-14 19:19 GMT-06:00 RomichG <notifications@github.com>:

> Assigned #551 <https://github.com/TeamMentor/TM_4_0_Design/issues/551> to
> @michaelhidalgo <https://github.com/michaelhidalgo>.
>
> —
> Reply to this email directly or view it on GitHub
> <https://github.com/TeamMentor/TM_4_0_Design/issues/551#event-254130205>.
>



-- 
Michael Hidalgo
http://michaelhidalgocr.blogspot.com

*The future has many names: For the weak, it means the unattainable. For
the fearful, it means the unknown. For the courageous, it means
opportunity. (1802-1885) French Poet, Dramatist, Writer*

**Comment by michaelhidalgo** [comment]
With Pull request https://github.com/TeamMentor/TM_4_0_Design/pull/608

**Comment by roman87** [comment]
Overall looks good. Couple of things:

- [ ] For some reason it takes a very long time to get there error when the DNS resolves but the server is unavailable. (Basically there is internet connection but 3.5 is down) It gets to the point where the browser resets the connection. I think some network timeouts are wrong.

![selection_164](https://cloud.githubusercontent.com/assets/1326120/6869168/56800a74-d468-11e4-9887-de9dd5be0007.png)


When there is no internet connection things work fine, lets change:
- [ ] The error message to say "We are sorry but TEAM Mentor is currently unavailable, please contact support at support@securityinnovation.com"

- [ ] Lets clear the username and password. Right now it shows as "undefined"

![selection_165](https://cloud.githubusercontent.com/assets/1326120/6869170/64e7f54a-d468-11e4-815a-c33b464361ca.png)

**Comment by michaelhidalgo** [comment]
@roman87 , I changed the error message. However,the UI looks a bit busy, what do you think?

@DinisCruz , in order to display the mailto link, we need to unescape the HTML in this alert (by using exclamation mark) = #message  != 'Error: ' + viewModel.errorMessage

Do you think is it a security risk?




![screen shot 2015-04-01 at 4 01 45 pm](https://cloud.githubusercontent.com/assets/1732035/6953701/5b9d2c48-d888-11e4-9994-aae1fbf69298.png)

**Comment by roman87** [comment]
As we discussed - changed it to "TEAM Mentor is unavailable, please contact us at"

**Comment by DinisCruz** [comment]
> #message != 'Error: ' + viewModel.errorMessage
yes that will allow html injection via the ```errorMessage```

there are ways to show those links in jade

can you post here an example of what you want it to look like, and I can show you the way to do it in Jade

**Comment by DinisCruz** [comment]
btw, on this case why do we show that login page at all, wouldn't it be better to redirect to one of the error pages?

**Comment by michaelhidalgo** [comment]
That's a good point :) 

@roman87  what do you think? We could add some logs entries and then redirect the user to the login page? Maybe display the HTTP 500 error page.

**Comment by roman87** [comment]
Well, It is a good point, however, I think this is being consistent with our general error scheme. I think it is more comforting for the user to see a familiar page than some 500 error they have never seen. So I think lets keep it as agreed.

**Comment by michaelhidalgo** [comment]
@roman87  , @DinisCruz 

this is how the Login form would look like if the TM server is unavailable : 

![screen shot 2015-04-05 at 3 54 59 pm](https://cloud.githubusercontent.com/assets/1732035/6998831/d59e0f50-dbab-11e4-8272-1c28a91828eb.png)

This is how the  Signup form should work : 

![screen shot 2015-04-05 at 3 55 23 pm](https://cloud.githubusercontent.com/assets/1732035/6998839/048d6df6-dbac-11e4-8a74-9253efbae641.png)


We agreed on keeping the text for Signup.

@DinisCruz , since we need to show the error message coming back from the controller, with the mailto, we need to allow that label to render HTML .I

```coffeescript
mixin alert-sign-up-failed
  if viewModel && viewModel.errorMessage
    .alert(role='alert')
      #message!= 'Error: ' + viewModel.errorMessage
```

**Comment by michaelhidalgo** [comment]
With Pull Request [https://github.com/TeamMentor/TM_4_0_Design/issues/551]

**Comment by roman87** [comment]
@DinisCruz can you take a look and merge this?

**Comment by DinisCruz** [comment]
Just commented on it, we need a better solution to provide the tm support email

**Comment by roman87** [comment]
@DiniCruz @michaelhidalgo why can't we just use the same solution we use for displaying the "Found an issue? Send us an email."  Are we making this more complicated than it is?

**Comment by michaelhidalgo** [comment]
I think that the main difference with this link and the one you are
referring to, is that the former is a message coming from the back end and
Jade encodes output by default, so this is how we display the backend
message :  #message = 'Error: ' + viewModel.errorMessage , but since the
errorMessage contains the link tag, it won't be rendered.


 The latter in the other hand, is a HTML link <a href.



2015-04-06 11:19 GMT-06:00 RomichG <notifications@github.com>:

> @DiniCruz @michaelhidalgo <https://github.com/michaelhidalgo> why can't
> we just use the same solution we use for displaying the "Found an issue?
> Send us an email." Are we making this more complicated than it is?
>
> —
> Reply to this email directly or view it on GitHub
> <https://github.com/TeamMentor/TM_4_0_Design/issues/551#issuecomment-90161376>
> .
>



-- 
Michael Hidalgo
http://michaelhidalgocr.blogspot.com

*The future has many names: For the weak, it means the unattainable. For
the fearful, it means the unknown. For the courageous, it means
opportunity. (1802-1885) French Poet, Dramatist, Writer*

**Comment by DinisCruz** [comment]
yap @michaelhidalgo is correct, its a different flow

**Comment by roman87** [comment]
Ah..got it.

**Comment by michaelhidalgo** [comment]
@DinisCruz  can you please review this https://github.com/TeamMentor/TM_4_0_Design/pull/663/files

**Comment by pjenney58** [comment]
BTW,  Happy Birthday @michaelhidalgo <https://github.com/michaelhidalgo> !

Cheers!

pete.;1


---)-------------------------------------
Security Innovation, Inc.
Peter H. Jenney
VP, Strategic Initiatives
Ombudsman

o:  978.694.1008 x164
m: 603.264.3961
Skype: PeteJenney

**Comment by michaelhidalgo** [comment]
Thanks Pete :)

2015-04-09 6:36 GMT-06:00 Pete Jenney <notifications@github.com>:

> BTW, Happy Birthday @michaelhidalgo <https://github.com/michaelhidalgo> !
>
> Cheers!
>
> pete.;1
>
>
> ---)-------------------------------------
> Security Innovation, Inc.
> Peter H. Jenney
> VP, Strategic Initiatives
> Ombudsman
>
> o: 978.694.1008 x164
> m: 603.264.3961
> Skype: PeteJenney
>
>
>
>
>
> > On Apr 8, 2015, at 5:51 PM, Michael Hidalgo <notifications@github.com>
> wrote:
> >
> > @DinisCruz <https://github.com/DinisCruz> can you please review this
> https://github.com/TeamMentor/TM_4_0_Design/pull/663/files <
> https://github.com/TeamMentor/TM_4_0_Design/pull/663/files>
> > —
> > Reply to this email directly or view it on GitHub <
> https://github.com/TeamMentor/TM_4_0_Design/issues/551#issuecomment-91046487
> >.
>
> >
>
> —
> Reply to this email directly or view it on GitHub
> <https://github.com/TeamMentor/TM_4_0_Design/issues/551#issuecomment-91217110>
> .
>



-- 
Michael Hidalgo
http://michaelhidalgocr.blogspot.com

*The future has many names: For the weak, it means the unattainable. For
the fearful, it means the unknown. For the courageous, it means
opportunity. (1802-1885) French Poet, Dramatist, Writer*

**Comment by roman87** [comment]
Bumping this up so we can merge it.

**Comment by DinisCruz** [comment]
code merged

**Comment by roman87** [comment]
So this is not working exactly as expected. If the server is completely down and does not respond (i.e no response to TCP connection, then eventually the browser times out and does not display the error. 
![selection_178](https://cloud.githubusercontent.com/assets/1326120/7120137/db2fea28-e1d8-11e4-9126-61216f43301d.png)


Here is the log:
2015-04-13T16:23:22.054Z - info:  url=/user/login, ip=127.0.0.1, agent=undefined
2015-04-13T16:25:22.127Z - info:  url=/user/login, ip=127.0.0.1, agent=undefined
2015-04-13T16:25:29.340Z - info: Could not connect with TM 3.5 server
2015-04-13T16:25:29.341Z - info: TEAM Mentor is unavailable, please contact us at 
2015-04-13T16:27:29.406Z - info: Could not connect with TM 3.5 server
2015-04-13T16:27:29.406Z - info: TEAM Mentor is unavailable, please contact us at 

And here is the tcpdump
12:23:22.056472 IP 10.0.2.15.56489 > tmdevr01-beta35.teammentor.net.https: Flags [S], seq 1966781655, win 29200, options [mss 1460,sackOK,TS val 8982803 ecr 0,nop,wscale 7], length 0
12:23:23.056370 IP 10.0.2.15.56489 > tmdevr01-beta35.teammentor.net.https: Flags [S], seq 1966781655, win 29200, options [mss 1460,sackOK,TS val 8983053 ecr 0,nop,wscale 7], length 0
12:23:25.064291 IP 10.0.2.15.56489 > tmdevr01-beta35.teammentor.net.https: Flags [S], seq 1966781655, win 29200, options [mss 1460,sackOK,TS val 8983555 ecr 0,nop,wscale 7], length 0
12:23:29.068360 IP 10.0.2.15.56489 > tmdevr01-beta35.teammentor.net.https: Flags [S], seq 1966781655, win 29200, options [mss 1460,sackOK,TS val 8984556 ecr 0,nop,wscale 7], length 0
12:23:37.084636 IP 10.0.2.15.56489 > tmdevr01-beta35.teammentor.net.https: Flags [S], seq 1966781655, win 29200, options [mss 1460,sackOK,TS val 8986560 ecr 0,nop,wscale 7], length 0
12:23:53.116299 IP 10.0.2.15.56489 > tmdevr01-beta35.teammentor.net.https: Flags [S], seq 1966781655, win 29200, options [mss 1460,sackOK,TS val 8990568 ecr 0,nop,wscale 7], length 0
12:24:25.212237 IP 10.0.2.15.56489 > tmdevr01-beta35.teammentor.net.https: Flags [S], seq 1966781655, win 29200, options [mss 1460,sackOK,TS val 8998592 ecr 0,nop,wscale 7], length 0
12:25:22.134171 IP 10.0.2.15.56491 > tmdevr01-beta35.teammentor.net.https: Flags [S], seq 2867513645, win 29200, options [mss 1460,sackOK,TS val 9012822 ecr 0,nop,wscale 7], length 0
12:25:23.132309 IP 10.0.2.15.56491 > tmdevr01-beta35.teammentor.net.https: Flags [S], seq 2867513645, win 29200, options [mss 1460,sackOK,TS val 9013072 ecr 0,nop,wscale 7], length 0
12:25:25.136220 IP 10.0.2.15.56491 > tmdevr01-beta35.teammentor.net.https: Flags [S], seq 2867513645, win 29200, options [mss 1460,sackOK,TS val 9013573 ecr 0,nop,wscale 7], length 0
12:25:29.148289 IP 10.0.2.15.56491 > tmdevr01-beta35.teammentor.net.https: Flags [S], seq 2867513645, win 29200, options [mss 1460,sackOK,TS val 9014576 ecr 0,nop,wscale 7], length 0
12:25:37.164389 IP 10.0.2.15.56491 > tmdevr01-beta35.teammentor.net.https: Flags [S], seq 2867513645, win 29200, options [mss 1460,sackOK,TS val 9016580 ecr 0,nop,wscale 7], length 0
12:25:53.212182 IP 10.0.2.15.56491 > tmdevr01-beta35.teammentor.net.https: Flags [S], seq 2867513645, win 29200, options [mss 1460,sackOK,TS val 9020592 ecr 0,nop,wscale 7], length 0
12:26:25.276187 IP 10.0.2.15.56491 > tmdevr01-beta35.teammentor.net.https: Flags [S], seq 2867513645, win 29200, options [mss 1460,sackOK,TS val 9028608 ecr 0,nop,wscale 7], length 0

**Comment by roman87** [comment]
As you can see from the tcpdump above, TCP connection was never established.

Here is a scenario that works. In this case I just paused the 3.5 VM so the network traffic is local and times out on arp request:

tcpdump:
12:35:46.252374 ARP, Request who-has tmdevr01-beta35.teammentor.net tell 192.168.250.110, length 28
12:35:47.252322 ARP, Request who-has tmdevr01-beta35.teammentor.net tell 192.168.250.110, length 28
12:35:48.253797 ARP, Request who-has tmdevr01-beta35.teammentor.net tell 192.168.250.110, length 28
12:35:49.252246 ARP, Request who-has tmdevr01-beta35.teammentor.net tell 192.168.250.110, length 28
12:35:50.252316 ARP, Request who-has tmdevr01-beta35.teammentor.net tell 192.168.250.110, length 28
12:35:51.253319 ARP, Request who-has tmdevr01-beta35.teammentor.net tell 192.168.250.110, length 28

LOG:
2015-04-13T16:35:46.250Z - info:  url=/user/login, ip=127.0.0.1, agent=undefined
2015-04-13T16:35:49.253Z - info: Could not connect with TM 3.5 server
2015-04-13T16:35:49.253Z - info: TEAM Mentor is unavailable, please contact us at 

![selection_179](https://cloud.githubusercontent.com/assets/1326120/7120276/f3a6e722-e1d9-11e4-94b9-422605e471f5.png)

**Comment by michaelhidalgo** [comment]
hmm, can we reproduce this behavior with Chrome or other browser? I think the connection reset message is provided by the browser.

**Comment by roman87** [comment]
It is really simple to reproduce. 
1. Change hosts file on your local box to point the DNS name of the 3.5 server to a non existent ip address. In my case here is how it looks like:
My src/misc/Config.json:
```
       @tm_35_Server      ='https://tmdevr01-beta35.teammentor.net/'
```

My hosts file:

```
191.168.250.53	tmdevr01-beta35.teammentor.net
```

Which makes all the 3.5 requests go to 192.168.250.53, which is a non-responsive IP address. 

The browser provides the reset message because it doesn't receive anything from TM 4.0.
